                 [
                   {
                      "inactive":false,
                      "housingInventoryId":"b7557434-6d2c-43c5-a002-665b95deaed8",
                      "bedsCurrent":5,
                      "projectId":"test-project",
                      "userId":"shubas",
                      "bedsCapacity":6,
                      "familyUnit":false,
                      "inService":false,
                      "vacant":false,
                      "aliasName":"Test Name"
                   }
                  ]
